{
  "schema_version": 1,
  "record_type": "prompt_event",
  "prompt_id": "prompt-dfe76c5009853cde5023ef3b",
  "occurred_at": "2026-07-17T18:15:18.367129Z",
  "captured_at": "2026-07-17T18:15:18.367805Z",
  "member_id": "hdtruong802",
  "tool": "codex",
  "event": "UserPrompt",
  "prompt": "push code l?n truong",
  "prompt_preview": "push code l?n truong",
  "model": null,
  "task_record": "local-20260718-backend-api-foundation",
  "branch": "feature/local-20260718-backend-api-foundation",
  "workspace_fingerprint": "29aa416e0bb250a6b4670ada7dbae02bdeb972e36fb01db0ae28310d10af8a5d",
  "source": {
    "session_hash": "21f57a46bd3e138ebe61fa486328be223cb4cf733f5c8ab4ba27ac1fa167305a",
    "adapter": "manual",
    "adapter_version": "1"
  },
  "sanitization": {
    "redacted": false,
    "categories": []
  },
  "capture_warnings": []
}
