{
  "schema_version": 1,
  "record_type": "prompt_event",
  "prompt_id": "prompt-db67d3ac52e3b07fc781505d",
  "occurred_at": "2026-07-18T07:15:03.667566Z",
  "captured_at": "2026-07-18T07:15:03.668471Z",
  "member_id": "hdtruong802",
  "tool": "codex",
  "event": "UserPrompt",
  "prompt": "??ng b? dev v?o truong; t? x? l? conflict ch? trong backend, gi? API prototype v? RAG/LLM, kh?ng s?a frontend.",
  "prompt_preview": "??ng b? dev v?o truong; t? x? l? conflict ch? trong backend, gi? API prototype v? RAG/LLM, kh?ng s?a frontend.",
  "model": null,
  "task_record": "local-20260718-truong-dev-sync",
  "branch": "truong",
  "workspace_fingerprint": "29aa416e0bb250a6b4670ada7dbae02bdeb972e36fb01db0ae28310d10af8a5d",
  "source": {
    "session_hash": "ef01e6a71103566a27ed2416582fa3aa2798509775de0c40ac637828c631bc4e",
    "adapter": "manual",
    "adapter_version": "1"
  },
  "sanitization": {
    "redacted": false,
    "categories": []
  },
  "capture_warnings": []
}
