{
  "schema_version": 1,
  "record_type": "prompt_event",
  "prompt_id": "prompt-aceb49b266107121e163bb27",
  "occurred_at": "2026-07-18T13:07:41.030936Z",
  "captured_at": "2026-07-18T13:07:41.031127Z",
  "member_id": "hdtruong802",
  "tool": "codex",
  "event": "UserPrompt",
  "prompt": "Push the validated CI, API contract, and direct CORS integration changes to dev for a main PR. Stop on conflicts, failed checks, or remote changes during merge.",
  "prompt_preview": "Push the validated CI, API contract, and direct CORS integration changes to dev for a main PR. Stop on conflicts, failed checks, or remote changes during merge.",
  "model": null,
  "task_record": "local-20260718-main-ci-api-integration",
  "branch": "fix/local-20260718-main-ci-api-integration",
  "workspace_fingerprint": "29aa416e0bb250a6b4670ada7dbae02bdeb972e36fb01db0ae28310d10af8a5d",
  "source": {
    "session_hash": "a1c6ea593dcdf6691b183a3472752f7c9c0f219323abfa031e8c3168fe513cc2",
    "adapter": "manual",
    "adapter_version": "1"
  },
  "sanitization": {
    "redacted": false,
    "categories": []
  },
  "capture_warnings": []
}
