{
  "schema_version": 1,
  "record_type": "prompt_event",
  "prompt_id": "prompt-942f9e446190a659e46fe174",
  "occurred_at": "2026-07-19T01:30:12.068693Z",
  "captured_at": "2026-07-19T01:30:12.068913Z",
  "member_id": "hdtruong802",
  "tool": "codex",
  "event": "UserPrompt",
  "prompt": "Check PR #38 failing CI and fix the backend formatter and AI Log history policy so the PR can merge into main.",
  "prompt_preview": "Check PR #38 failing CI and fix the backend formatter and AI Log history policy so the PR can merge into main.",
  "model": null,
  "task_record": "local-20260719-pr38-ci",
  "branch": "fix/local-20260719-pr38-ci",
  "workspace_fingerprint": "29aa416e0bb250a6b4670ada7dbae02bdeb972e36fb01db0ae28310d10af8a5d",
  "source": {
    "session_hash": "fdb64f1781dd98f0bce33661d6999de21485a1cebe1f0846bf0dda6f9634fcf7",
    "adapter": "manual",
    "adapter_version": "1"
  },
  "sanitization": {
    "redacted": false,
    "categories": []
  },
  "capture_warnings": []
}
