{
  "schema_version": 1,
  "record_type": "prompt_event",
  "prompt_id": "prompt-57a985d93800f3e906c7b405",
  "occurred_at": "2026-07-18T06:34:59.044357Z",
  "captured_at": "2026-07-18T06:34:59.044560Z",
  "member_id": "hdtruong802",
  "tool": "codex",
  "event": "UserPrompt",
  "prompt": "push l?n truong",
  "prompt_preview": "push l?n truong",
  "model": null,
  "task_record": "local-20260718-prototype-api-contract",
  "branch": "chore/local-20260718-prototype-api-truong",
  "workspace_fingerprint": "29aa416e0bb250a6b4670ada7dbae02bdeb972e36fb01db0ae28310d10af8a5d",
  "source": {
    "session_hash": "2d1b011a52331d38adffa3af8896e633821d22af95b2fe9ffb2b0650ac7f76b4",
    "adapter": "manual",
    "adapter_version": "1"
  },
  "sanitization": {
    "redacted": false,
    "categories": []
  },
  "capture_warnings": []
}
