{
  "schema_version": 1,
  "record_type": "prompt_event",
  "prompt_id": "prompt-d5bb3d2cba96b48a4738eb4e",
  "occurred_at": "2026-07-17T17:34:13.698433Z",
  "captured_at": "2026-07-17T17:34:13.698646Z",
  "member_id": "hdtruong802",
  "tool": "codex",
  "event": "UserPrompt",
  "prompt": "T?i ?u v? l?m l?i ph?n CI/CD cho th?c s? ph? h?p v?i d? ?n v? t?i ?u t?c ?? check ?? merge, hi?n t?i check ?ang qu? l?u.",
  "prompt_preview": "T?i ?u v? l?m l?i ph?n CI/CD cho th?c s? ph? h?p v?i d? ?n v? t?i ?u t?c ?? check ?? merge, hi?n t?i check ?ang qu? l?u.",
  "model": null,
  "task_record": "local-20260718-ci-cd-optimization",
  "branch": "chore/local-20260718-ci-cd-optimization",
  "workspace_fingerprint": "29aa416e0bb250a6b4670ada7dbae02bdeb972e36fb01db0ae28310d10af8a5d",
  "source": {
    "session_hash": "b4046a368e426b1832cdae031064a311d97270182db80c27a1716bcb0dce9473",
    "adapter": "manual",
    "adapter_version": "1"
  },
  "sanitization": {
    "redacted": false,
    "categories": []
  },
  "capture_warnings": []
}
