{
  "schema_version": 1,
  "record_type": "prompt_event",
  "prompt_id": "prompt-4eefd530cbed1974f5c9be5f",
  "occurred_at": "2026-07-17T19:52:37.064382Z",
  "captured_at": "2026-07-17T19:52:37.064825Z",
  "member_id": "hdtruong802",
  "tool": "codex",
  "event": "UserPrompt",
  "prompt": "deploy cho t?i, ??m b?o c? url ?? s?n s?ng c?m sang frontend",
  "prompt_preview": "deploy cho t?i, ??m b?o c? url ?? s?n s?ng c?m sang frontend",
  "model": null,
  "task_record": "local-20260718-gcp-backend-deploy",
  "branch": "chore/local-20260718-gcp-backend-deploy",
  "workspace_fingerprint": "29aa416e0bb250a6b4670ada7dbae02bdeb972e36fb01db0ae28310d10af8a5d",
  "source": {
    "session_hash": "1d0c705bad4c2fa66d168dc9c4752355da5c4333589812214240ce19d8518987",
    "adapter": "manual",
    "adapter_version": "1"
  },
  "sanitization": {
    "redacted": false,
    "categories": []
  },
  "capture_warnings": []
}
