{
  "schema_version": 1,
  "record_type": "prompt_event",
  "prompt_id": "prompt-4c9e9d34a40e0d333695556f",
  "occurred_at": "2026-07-18T07:26:54.652343Z",
  "captured_at": "2026-07-18T07:26:54.652540Z",
  "member_id": "hdtruong802",
  "tool": "codex",
  "event": "UserPrompt",
  "prompt": "S?a backend CI: khai b?o dependency openai ?? pin ?? router RAG import ???c tr?n GitHub Actions.",
  "prompt_preview": "S?a backend CI: khai b?o dependency openai ?? pin ?? router RAG import ???c tr?n GitHub Actions.",
  "model": null,
  "task_record": "local-20260718-truong-dev-sync",
  "branch": "truong",
  "workspace_fingerprint": "29aa416e0bb250a6b4670ada7dbae02bdeb972e36fb01db0ae28310d10af8a5d",
  "source": {
    "session_hash": "4b16e92b5302391e35a342dd68e6b926e493df5b452d04bb38e2943896d65bd6",
    "adapter": "manual",
    "adapter_version": "1"
  },
  "sanitization": {
    "redacted": false,
    "categories": []
  },
  "capture_warnings": []
}
