{
  "schema_version": 1,
  "record_type": "prompt_event",
  "prompt_id": "prompt-f0e7c600104312744da6dc28",
  "occurred_at": "2026-07-17T16:30:11.283087Z",
  "captured_at": "2026-07-17T16:30:11.284025Z",
  "member_id": "hdtruong802",
  "tool": "codex",
  "event": "UserPrompt",
  "prompt": "Push code hi???n t???i l??n GitHub branch truong.",
  "prompt_preview": "Push code hi???n t???i l??n GitHub branch truong.",
  "model": null,
  "task_record": "local-20260717-integrate-origin-main",
  "branch": "truong",
  "workspace_fingerprint": "29aa416e0bb250a6b4670ada7dbae02bdeb972e36fb01db0ae28310d10af8a5d",
  "source": {
    "session_hash": "e90a0dafb66de6024f8924dae8349800b20228c6513a7c22f2b721972885100f",
    "adapter": "manual",
    "adapter_version": "1"
  },
  "sanitization": {
    "redacted": false,
    "categories": []
  },
  "capture_warnings": []
}
