{
  "schema_version": 1,
  "record_type": "prompt_event",
  "prompt_id": "prompt-85f2872e9e13ecd57e1d41db",
  "occurred_at": "2026-07-18T04:23:17.316834Z",
  "captured_at": "2026-07-18T04:23:17.317035Z",
  "member_id": "hdtruong802",
  "tool": "codex",
  "event": "UserPrompt",
  "prompt": "Hi?n PR #16 ?ang fail CI/CD n?n ch?a merge v?o main. T?i kh?ng mu?n merge v?o m? push nh?ng thay ??i m?i l?n truong ?? s?n s?ng t?o PR.",
  "prompt_preview": "Hi?n PR #16 ?ang fail CI/CD n?n ch?a merge v?o main. T?i kh?ng mu?n merge v?o m? push nh?ng thay ??i m?i l?n truong ?? s?n s?ng t?o PR.",
  "model": null,
  "task_record": "local-20260718-backend-ci-format",
  "branch": "fix/local-20260718-backend-ci-format",
  "workspace_fingerprint": "29aa416e0bb250a6b4670ada7dbae02bdeb972e36fb01db0ae28310d10af8a5d",
  "source": {
    "session_hash": "4226dbd23122190ad332681ec9006a5ad26f350b9e9d056939153d070da10921",
    "adapter": "manual",
    "adapter_version": "1"
  },
  "sanitization": {
    "redacted": false,
    "categories": []
  },
  "capture_warnings": []
}
